{"$id":"urn:rsi:fixture-corpus:v0","$schema":"https://json-schema.org/draft/2020-12/schema","additionalProperties":false,"properties":{"corpus_id":{"pattern":"^[a-z0-9][a-z0-9._-]{0,63}$","type":"string"},"fixture_directory":{"minLength":1,"type":"string"},"fixtures":{"items":{"additionalProperties":false,"properties":{"adapter_bindings":{"additionalProperties":{"minLength":1,"type":"string"},"minProperties":1,"propertyNames":{"minLength":1,"type":"string"},"type":"object"},"expectation_profile_id":{"minLength":1,"type":"string"},"fixture_id":{"pattern":"^[a-z0-9][a-z0-9._-]{0,63}:[A-Za-z0-9][A-Za-z0-9._-]{0,127}$","type":"string"},"fixture_source_id":{"minLength":1,"type":"string"},"path":{"minLength":1,"type":"string"}},"required":["fixture_id","fixture_source_id","path","expectation_profile_id","adapter_bindings"],"type":"object"},"minItems":1,"type":"array"},"namespace":{"pattern":"^[a-z0-9][a-z0-9._-]{0,63}$","type":"string"},"schema":{"const":"rsi-fixture-corpus.v0"}},"required":["schema","corpus_id","namespace","fixture_directory","fixtures"],"type":"object"}
