{"corpus_id":"pq-policy-asof","fixture_directory":"corpora/pq/fixtures","fixtures":[{"adapter_bindings":{"binding":"pq.policy-asof.v0"},"expectation_profile_id":"pq.policy-asof.v0","fixture_id":"pq:PQ-RSI-001","fixture_source_id":"PQ-RSI-001","path":"corpora/pq/fixtures/PQ-RSI-001.json"},{"adapter_bindings":{"binding":"pq.policy-asof.v0"},"expectation_profile_id":"pq.policy-asof.v0","fixture_id":"pq:PQ-RSI-002","fixture_source_id":"PQ-RSI-002","path":"corpora/pq/fixtures/PQ-RSI-002.json"},{"adapter_bindings":{"binding":"pq.policy-asof.v0"},"expectation_profile_id":"pq.policy-asof.v0","fixture_id":"pq:PQ-RSI-003","fixture_source_id":"PQ-RSI-003","path":"corpora/pq/fixtures/PQ-RSI-003.json"},{"adapter_bindings":{"binding":"pq.policy-asof.v0"},"expectation_profile_id":"pq.policy-asof.v0","fixture_id":"pq:PQ-RSI-004","fixture_source_id":"PQ-RSI-004","path":"corpora/pq/fixtures/PQ-RSI-004.json"},{"adapter_bindings":{"binding":"pq.policy-asof.v0"},"expectation_profile_id":"pq.policy-asof.v0","fixture_id":"pq:PQ-RSI-005","fixture_source_id":"PQ-RSI-005","path":"corpora/pq/fixtures/PQ-RSI-005.json"},{"adapter_bindings":{"binding":"pq.policy-asof.v0"},"expectation_profile_id":"pq.policy-asof.v0","fixture_id":"pq:PQ-RSI-007","fixture_source_id":"PQ-RSI-007","path":"corpora/pq/fixtures/PQ-RSI-007.json"}],"namespace":"pq","schema":"rsi-fixture-corpus.v0"}
