{"corpus_id":"judgment-record","fixture_directory":"corpora/judgment/fixtures","fixtures":[{"adapter_bindings":{"binding":"erc8299.judgment-record-binding.v0"},"expectation_profile_id":"erc8299.judgment-record-binding.v0","fixture_id":"judgment:JEX-RSI-001","fixture_source_id":"JEX-RSI-001","path":"corpora/judgment/fixtures/JEX-RSI-001.json"},{"adapter_bindings":{"binding":"erc8299.judgment-record-binding.v0"},"expectation_profile_id":"erc8299.judgment-record-binding.v0","fixture_id":"judgment:JEX-RSI-002","fixture_source_id":"JEX-RSI-002","path":"corpora/judgment/fixtures/JEX-RSI-002.json"},{"adapter_bindings":{"binding":"erc8299.judgment-record-binding.v0"},"expectation_profile_id":"erc8299.judgment-record-binding.v0","fixture_id":"judgment:JEX-RSI-003","fixture_source_id":"JEX-RSI-003","path":"corpora/judgment/fixtures/JEX-RSI-003.json"},{"adapter_bindings":{"binding":"erc8299.judgment-record-binding.v0"},"expectation_profile_id":"erc8299.judgment-record-binding.v0","fixture_id":"judgment:JEX-RSI-004","fixture_source_id":"JEX-RSI-004","path":"corpora/judgment/fixtures/JEX-RSI-004.json"},{"adapter_bindings":{"binding":"erc8299.judgment-record-binding.v0"},"expectation_profile_id":"erc8299.judgment-record-binding.v0","fixture_id":"judgment:JEX-RSI-005","fixture_source_id":"JEX-RSI-005","path":"corpora/judgment/fixtures/JEX-RSI-005.json"},{"adapter_bindings":{"binding":"erc8299.judgment-record-binding.v0"},"expectation_profile_id":"erc8299.judgment-record-binding.v0","fixture_id":"judgment:JEX-RSI-006","fixture_source_id":"JEX-RSI-006","path":"corpora/judgment/fixtures/JEX-RSI-006.json"},{"adapter_bindings":{"binding":"erc8299.judgment-record-binding.v0"},"expectation_profile_id":"erc8299.judgment-record-binding.v0","fixture_id":"judgment:JEX-RSI-007","fixture_source_id":"JEX-RSI-007","path":"corpora/judgment/fixtures/JEX-RSI-007.json"},{"adapter_bindings":{"binding":"erc8299.judgment-record-binding.v0"},"expectation_profile_id":"erc8299.judgment-record-binding.v0","fixture_id":"judgment:JEX-RSI-008","fixture_source_id":"JEX-RSI-008","path":"corpora/judgment/fixtures/JEX-RSI-008.json"},{"adapter_bindings":{"binding":"erc8299.judgment-record-binding.v0"},"expectation_profile_id":"erc8299.judgment-record-binding.v0","fixture_id":"judgment:JEX-RSI-009","fixture_source_id":"JEX-RSI-009","path":"corpora/judgment/fixtures/JEX-RSI-009.json"},{"adapter_bindings":{"binding":"erc8299.judgment-record-binding.v0"},"expectation_profile_id":"erc8299.judgment-record-binding.v0","fixture_id":"judgment:JEX-RSI-010","fixture_source_id":"JEX-RSI-010","path":"corpora/judgment/fixtures/JEX-RSI-010.json"},{"adapter_bindings":{"binding":"erc8299.judgment-record-binding.v0"},"expectation_profile_id":"erc8299.judgment-record-binding.v0","fixture_id":"judgment:JEX-RSI-011","fixture_source_id":"JEX-RSI-011","path":"corpora/judgment/fixtures/JEX-RSI-011.json"},{"adapter_bindings":{"binding":"erc8299.judgment-record-binding.v0"},"expectation_profile_id":"erc8299.judgment-record-binding.v0","fixture_id":"judgment:JEX-RSI-012","fixture_source_id":"JEX-RSI-012","path":"corpora/judgment/fixtures/JEX-RSI-012.json"}],"namespace":"judgment","schema":"rsi-fixture-corpus.v0"}
