{"corpus_id":"verify-layer-proof","fixture_directory":"corpora/verify-layer/fixtures","fixtures":[{"adapter_bindings":{"binding":"verify-layer.proof-context.v0"},"expectation_profile_id":"verify-layer.proof-context.v0","fixture_id":"verify-layer:VL-RSI-001","fixture_source_id":"VL-RSI-001","path":"corpora/verify-layer/fixtures/VL-RSI-001.json"},{"adapter_bindings":{"binding":"verify-layer.proof-context.v0"},"expectation_profile_id":"verify-layer.proof-context.v0","fixture_id":"verify-layer:VL-RSI-002","fixture_source_id":"VL-RSI-002","path":"corpora/verify-layer/fixtures/VL-RSI-002.json"},{"adapter_bindings":{"binding":"verify-layer.proof-context.v0"},"expectation_profile_id":"verify-layer.proof-context.v0","fixture_id":"verify-layer:VL-RSI-005","fixture_source_id":"VL-RSI-005","path":"corpora/verify-layer/fixtures/VL-RSI-005.json"},{"adapter_bindings":{"binding":"verify-layer.proof-context.v0"},"expectation_profile_id":"verify-layer.proof-context.v0","fixture_id":"verify-layer:VL-RSI-006","fixture_source_id":"VL-RSI-006","path":"corpora/verify-layer/fixtures/VL-RSI-006.json"},{"adapter_bindings":{"binding":"verify-layer.proof-context.v0"},"expectation_profile_id":"verify-layer.proof-context.v0","fixture_id":"verify-layer:VL-RSI-007","fixture_source_id":"VL-RSI-007","path":"corpora/verify-layer/fixtures/VL-RSI-007.json"},{"adapter_bindings":{"binding":"verify-layer.proof-context.v0"},"expectation_profile_id":"verify-layer.proof-context.v0","fixture_id":"verify-layer:VL-RSI-008","fixture_source_id":"VL-RSI-008","path":"corpora/verify-layer/fixtures/VL-RSI-008.json"}],"namespace":"verify-layer","schema":"rsi-fixture-corpus.v0"}
