{"corpus_id":"semantic-abi-edge","fixture_directory":"corpora/semantic-abi/fixtures","fixtures":[{"adapter_bindings":{"binding":"semantic-abi.claim-edge.v0"},"expectation_profile_id":"semantic-abi.claim-edge.v0","fixture_id":"semantic-abi:SABI-RSI-001","fixture_source_id":"SABI-RSI-001","path":"corpora/semantic-abi/fixtures/SABI-RSI-001.json"},{"adapter_bindings":{"binding":"semantic-abi.claim-edge.v0"},"expectation_profile_id":"semantic-abi.claim-edge.v0","fixture_id":"semantic-abi:SABI-RSI-002","fixture_source_id":"SABI-RSI-002","path":"corpora/semantic-abi/fixtures/SABI-RSI-002.json"},{"adapter_bindings":{"binding":"semantic-abi.claim-edge.v0"},"expectation_profile_id":"semantic-abi.claim-edge.v0","fixture_id":"semantic-abi:SABI-RSI-003","fixture_source_id":"SABI-RSI-003","path":"corpora/semantic-abi/fixtures/SABI-RSI-003.json"},{"adapter_bindings":{"binding":"semantic-abi.claim-edge.v0"},"expectation_profile_id":"semantic-abi.claim-edge.v0","fixture_id":"semantic-abi:SABI-RSI-004","fixture_source_id":"SABI-RSI-004","path":"corpora/semantic-abi/fixtures/SABI-RSI-004.json"},{"adapter_bindings":{"binding":"semantic-abi.claim-edge.v0"},"expectation_profile_id":"semantic-abi.claim-edge.v0","fixture_id":"semantic-abi:SABI-RSI-005","fixture_source_id":"SABI-RSI-005","path":"corpora/semantic-abi/fixtures/SABI-RSI-005.json"},{"adapter_bindings":{"binding":"semantic-abi.claim-edge.v0"},"expectation_profile_id":"semantic-abi.claim-edge.v0","fixture_id":"semantic-abi:SABI-RSI-006","fixture_source_id":"SABI-RSI-006","path":"corpora/semantic-abi/fixtures/SABI-RSI-006.json"},{"adapter_bindings":{"binding":"semantic-abi.claim-edge.v0"},"expectation_profile_id":"semantic-abi.claim-edge.v0","fixture_id":"semantic-abi:SABI-RSI-007","fixture_source_id":"SABI-RSI-007","path":"corpora/semantic-abi/fixtures/SABI-RSI-007.json"},{"adapter_bindings":{"binding":"semantic-abi.claim-edge.v0"},"expectation_profile_id":"semantic-abi.claim-edge.v0","fixture_id":"semantic-abi:SABI-RSI-008","fixture_source_id":"SABI-RSI-008","path":"corpora/semantic-abi/fixtures/SABI-RSI-008.json"},{"adapter_bindings":{"binding":"semantic-abi.claim-edge.v0"},"expectation_profile_id":"semantic-abi.claim-edge.v0","fixture_id":"semantic-abi:SABI-RSI-009","fixture_source_id":"SABI-RSI-009","path":"corpora/semantic-abi/fixtures/SABI-RSI-009.json"},{"adapter_bindings":{"binding":"semantic-abi.claim-edge.v0"},"expectation_profile_id":"semantic-abi.claim-edge.v0","fixture_id":"semantic-abi:SABI-RSI-010","fixture_source_id":"SABI-RSI-010","path":"corpora/semantic-abi/fixtures/SABI-RSI-010.json"},{"adapter_bindings":{"binding":"semantic-abi.claim-edge.v0"},"expectation_profile_id":"semantic-abi.claim-edge.v0","fixture_id":"semantic-abi:SABI-RSI-011","fixture_source_id":"SABI-RSI-011","path":"corpora/semantic-abi/fixtures/SABI-RSI-011.json"},{"adapter_bindings":{"binding":"semantic-abi.claim-edge.v0"},"expectation_profile_id":"semantic-abi.claim-edge.v0","fixture_id":"semantic-abi:SABI-RSI-012","fixture_source_id":"SABI-RSI-012","path":"corpora/semantic-abi/fixtures/SABI-RSI-012.json"},{"adapter_bindings":{"binding":"semantic-abi.claim-edge.v0"},"expectation_profile_id":"semantic-abi.claim-edge.v0","fixture_id":"semantic-abi:SABI-RSI-013","fixture_source_id":"SABI-RSI-013","path":"corpora/semantic-abi/fixtures/SABI-RSI-013.json"},{"adapter_bindings":{"binding":"semantic-abi.claim-edge.v0"},"expectation_profile_id":"semantic-abi.claim-edge.v0","fixture_id":"semantic-abi:SABI-RSI-014","fixture_source_id":"SABI-RSI-014","path":"corpora/semantic-abi/fixtures/SABI-RSI-014.json"},{"adapter_bindings":{"binding":"semantic-abi.claim-edge.v0"},"expectation_profile_id":"semantic-abi.claim-edge.v0","fixture_id":"semantic-abi:SABI-RSI-015","fixture_source_id":"SABI-RSI-015","path":"corpora/semantic-abi/fixtures/SABI-RSI-015.json"},{"adapter_bindings":{"binding":"semantic-abi.claim-edge.v0"},"expectation_profile_id":"semantic-abi.claim-edge.v0","fixture_id":"semantic-abi:SABI-RSI-016","fixture_source_id":"SABI-RSI-016","path":"corpora/semantic-abi/fixtures/SABI-RSI-016.json"}],"namespace":"semantic-abi","schema":"rsi-fixture-corpus.v0"}
