{"corpus_id":"rvr-digest-binding","fixture_directory":"corpora/rvr/fixtures","fixtures":[{"adapter_bindings":{"binding":"rvr.digest-binding.v0"},"expectation_profile_id":"rvr.digest-binding.v0","fixture_id":"rvr:RVR-RSI-001","fixture_source_id":"RVR-RSI-001","path":"corpora/rvr/fixtures/RVR-RSI-001.json"},{"adapter_bindings":{"binding":"rvr.digest-binding.v0"},"expectation_profile_id":"rvr.digest-binding.v0","fixture_id":"rvr:RVR-RSI-002","fixture_source_id":"RVR-RSI-002","path":"corpora/rvr/fixtures/RVR-RSI-002.json"},{"adapter_bindings":{"binding":"rvr.digest-binding.v0"},"expectation_profile_id":"rvr.digest-binding.v0","fixture_id":"rvr:RVR-RSI-003","fixture_source_id":"RVR-RSI-003","path":"corpora/rvr/fixtures/RVR-RSI-003.json"},{"adapter_bindings":{"binding":"rvr.digest-binding.v0"},"expectation_profile_id":"rvr.digest-binding.v0","fixture_id":"rvr:RVR-RSI-004","fixture_source_id":"RVR-RSI-004","path":"corpora/rvr/fixtures/RVR-RSI-004.json"},{"adapter_bindings":{"binding":"rvr.digest-binding.v0"},"expectation_profile_id":"rvr.digest-binding.v0","fixture_id":"rvr:RVR-RSI-005","fixture_source_id":"RVR-RSI-005","path":"corpora/rvr/fixtures/RVR-RSI-005.json"},{"adapter_bindings":{"binding":"rvr.digest-binding.v0"},"expectation_profile_id":"rvr.digest-binding.v0","fixture_id":"rvr:RVR-RSI-006","fixture_source_id":"RVR-RSI-006","path":"corpora/rvr/fixtures/RVR-RSI-006.json"}],"namespace":"rvr","schema":"rsi-fixture-corpus.v0"}
