{"corpus_id":"consult-escrow-release","fixture_directory":"corpora/consult-escrow/fixtures","fixtures":[{"adapter_bindings":{"binding":"consult-escrow.release-binding.v0"},"expectation_profile_id":"consult-escrow.release-binding.v0","fixture_id":"consult-escrow:CE-RSI-001","fixture_source_id":"CE-RSI-001","path":"corpora/consult-escrow/fixtures/CE-RSI-001.json"},{"adapter_bindings":{"binding":"consult-escrow.release-binding.v0"},"expectation_profile_id":"consult-escrow.release-binding.v0","fixture_id":"consult-escrow:CE-RSI-002","fixture_source_id":"CE-RSI-002","path":"corpora/consult-escrow/fixtures/CE-RSI-002.json"},{"adapter_bindings":{"binding":"consult-escrow.release-binding.v0"},"expectation_profile_id":"consult-escrow.release-binding.v0","fixture_id":"consult-escrow:CE-RSI-006","fixture_source_id":"CE-RSI-006","path":"corpora/consult-escrow/fixtures/CE-RSI-006.json"},{"adapter_bindings":{"binding":"consult-escrow.release-binding.v0"},"expectation_profile_id":"consult-escrow.release-binding.v0","fixture_id":"consult-escrow:CE-RSI-007","fixture_source_id":"CE-RSI-007","path":"corpora/consult-escrow/fixtures/CE-RSI-007.json"},{"adapter_bindings":{"binding":"consult-escrow.release-binding.v0"},"expectation_profile_id":"consult-escrow.release-binding.v0","fixture_id":"consult-escrow:CE-RSI-008","fixture_source_id":"CE-RSI-008","path":"corpora/consult-escrow/fixtures/CE-RSI-008.json"}],"namespace":"consult-escrow","schema":"rsi-fixture-corpus.v0"}
