{"corpus_id":"aggregate-budget","fixture_directory":"corpora/aggregate/fixtures","fixtures":[{"adapter_bindings":{"binding":"erc8312.aggregate-budget.v0"},"expectation_profile_id":"erc8312.aggregate-budget.v0","fixture_id":"aggregate:AGG-RSI-001","fixture_source_id":"AGG-RSI-001","path":"corpora/aggregate/fixtures/AGG-RSI-001.json"},{"adapter_bindings":{"binding":"erc8312.aggregate-budget.v0"},"expectation_profile_id":"erc8312.aggregate-budget.v0","fixture_id":"aggregate:AGG-RSI-002","fixture_source_id":"AGG-RSI-002","path":"corpora/aggregate/fixtures/AGG-RSI-002.json"},{"adapter_bindings":{"binding":"erc8312.aggregate-budget.v0"},"expectation_profile_id":"erc8312.aggregate-budget.v0","fixture_id":"aggregate:AGG-RSI-003","fixture_source_id":"AGG-RSI-003","path":"corpora/aggregate/fixtures/AGG-RSI-003.json"},{"adapter_bindings":{"binding":"erc8312.aggregate-budget.v0"},"expectation_profile_id":"erc8312.aggregate-budget.v0","fixture_id":"aggregate:AGG-RSI-004","fixture_source_id":"AGG-RSI-004","path":"corpora/aggregate/fixtures/AGG-RSI-004.json"},{"adapter_bindings":{"binding":"erc8312.aggregate-budget.v0"},"expectation_profile_id":"erc8312.aggregate-budget.v0","fixture_id":"aggregate:AGG-RSI-005","fixture_source_id":"AGG-RSI-005","path":"corpora/aggregate/fixtures/AGG-RSI-005.json"},{"adapter_bindings":{"binding":"erc8312.aggregate-budget.v0"},"expectation_profile_id":"erc8312.aggregate-budget.v0","fixture_id":"aggregate:AGG-RSI-006","fixture_source_id":"AGG-RSI-006","path":"corpora/aggregate/fixtures/AGG-RSI-006.json"},{"adapter_bindings":{"binding":"erc8312.aggregate-budget.v0"},"expectation_profile_id":"erc8312.aggregate-budget.v0","fixture_id":"aggregate:AGG-RSI-007","fixture_source_id":"AGG-RSI-007","path":"corpora/aggregate/fixtures/AGG-RSI-007.json"},{"adapter_bindings":{"binding":"erc8312.aggregate-budget.v0"},"expectation_profile_id":"erc8312.aggregate-budget.v0","fixture_id":"aggregate:AGG-RSI-008","fixture_source_id":"AGG-RSI-008","path":"corpora/aggregate/fixtures/AGG-RSI-008.json"},{"adapter_bindings":{"binding":"erc8312.aggregate-budget.v0"},"expectation_profile_id":"erc8312.aggregate-budget.v0","fixture_id":"aggregate:AGG-RSI-009","fixture_source_id":"AGG-RSI-009","path":"corpora/aggregate/fixtures/AGG-RSI-009.json"},{"adapter_bindings":{"binding":"erc8312.aggregate-budget.v0"},"expectation_profile_id":"erc8312.aggregate-budget.v0","fixture_id":"aggregate:AGG-RSI-010","fixture_source_id":"AGG-RSI-010","path":"corpora/aggregate/fixtures/AGG-RSI-010.json"},{"adapter_bindings":{"binding":"erc8312.aggregate-budget.v0"},"expectation_profile_id":"erc8312.aggregate-budget.v0","fixture_id":"aggregate:AGG-RSI-011","fixture_source_id":"AGG-RSI-011","path":"corpora/aggregate/fixtures/AGG-RSI-011.json"},{"adapter_bindings":{"binding":"erc8312.aggregate-budget.v0"},"expectation_profile_id":"erc8312.aggregate-budget.v0","fixture_id":"aggregate:AGG-RSI-012","fixture_source_id":"AGG-RSI-012","path":"corpora/aggregate/fixtures/AGG-RSI-012.json"}],"namespace":"aggregate","schema":"rsi-fixture-corpus.v0"}
