{"corpus_id":"tsei-serializer-adoption","fixture_directory":"corpora/tsei/fixtures","fixtures":[{"adapter_bindings":{"binding":"tsei.serializer-adoption.v0"},"expectation_profile_id":"tsei.serializer-adoption.v0","fixture_id":"tsei:TSEI-RSI-001","fixture_source_id":"TSEI-RSI-001","path":"corpora/tsei/fixtures/TSEI-RSI-001.json"},{"adapter_bindings":{"binding":"tsei.serializer-adoption.v0"},"expectation_profile_id":"tsei.serializer-adoption.v0","fixture_id":"tsei:TSEI-RSI-002","fixture_source_id":"TSEI-RSI-002","path":"corpora/tsei/fixtures/TSEI-RSI-002.json"},{"adapter_bindings":{"binding":"tsei.serializer-adoption.v0"},"expectation_profile_id":"tsei.serializer-adoption.v0","fixture_id":"tsei:TSEI-RSI-003","fixture_source_id":"TSEI-RSI-003","path":"corpora/tsei/fixtures/TSEI-RSI-003.json"},{"adapter_bindings":{"binding":"tsei.serializer-adoption.v0"},"expectation_profile_id":"tsei.serializer-adoption.v0","fixture_id":"tsei:TSEI-RSI-004","fixture_source_id":"TSEI-RSI-004","path":"corpora/tsei/fixtures/TSEI-RSI-004.json"},{"adapter_bindings":{"binding":"tsei.serializer-adoption.v0"},"expectation_profile_id":"tsei.serializer-adoption.v0","fixture_id":"tsei:TSEI-RSI-005","fixture_source_id":"TSEI-RSI-005","path":"corpora/tsei/fixtures/TSEI-RSI-005.json"},{"adapter_bindings":{"binding":"tsei.serializer-adoption.v0"},"expectation_profile_id":"tsei.serializer-adoption.v0","fixture_id":"tsei:TSEI-RSI-006","fixture_source_id":"TSEI-RSI-006","path":"corpora/tsei/fixtures/TSEI-RSI-006.json"},{"adapter_bindings":{"binding":"tsei.serializer-adoption.v0"},"expectation_profile_id":"tsei.serializer-adoption.v0","fixture_id":"tsei:TSEI-RSI-007","fixture_source_id":"TSEI-RSI-007","path":"corpora/tsei/fixtures/TSEI-RSI-007.json"}],"namespace":"tsei","schema":"rsi-fixture-corpus.v0"}
