{"corpus_id":"core","fixture_directory":"fixtures","fixtures":[{"adapter_bindings":{"generic":"generic","messaging":"messaging"},"expectation_profile_id":"core.synthetic.v0","fixture_id":"core:RSI-001","fixture_source_id":"RSI-001","path":"fixtures/RSI-001-signer-to-subject.json"},{"adapter_bindings":{"generic":"generic","messaging":"messaging"},"expectation_profile_id":"core.synthetic.v0","fixture_id":"core:RSI-003","fixture_source_id":"RSI-003","path":"fixtures/RSI-003-authentication-before-commit.json"},{"adapter_bindings":{"generic":"generic","messaging":"messaging"},"expectation_profile_id":"core.synthetic.v0","fixture_id":"core:RSI-004","fixture_source_id":"RSI-004","path":"fixtures/RSI-004-atomic-consumption.json"},{"adapter_bindings":{"generic":"generic","messaging":"messaging"},"expectation_profile_id":"core.synthetic.v0","fixture_id":"core:RSI-006","fixture_source_id":"RSI-006","path":"fixtures/RSI-006-context-binding.json"},{"adapter_bindings":{"generic":"generic","messaging":"messaging"},"expectation_profile_id":"core.synthetic.v0","fixture_id":"core:RSI-008","fixture_source_id":"RSI-008","path":"fixtures/RSI-008-evidence-bounded-status.json"},{"adapter_bindings":{"generic":"generic","messaging":"messaging"},"expectation_profile_id":"core.synthetic.v0","fixture_id":"core:RSI-009","fixture_source_id":"RSI-009","path":"fixtures/RSI-009-ingestion-equivalence.json"}],"namespace":"core","schema":"rsi-fixture-corpus.v0"}
