{"corpus_id":"tas-context-invocation","fixture_directory":"corpora/tas/fixtures","fixtures":[{"adapter_bindings":{"binding":"tas.context-invocation.v0"},"expectation_profile_id":"tas.context-invocation.v0","fixture_id":"tas:TAS-RSI-001","fixture_source_id":"TAS-RSI-001","path":"corpora/tas/fixtures/TAS-RSI-001.json"},{"adapter_bindings":{"binding":"tas.context-invocation.v0"},"expectation_profile_id":"tas.context-invocation.v0","fixture_id":"tas:TAS-RSI-002","fixture_source_id":"TAS-RSI-002","path":"corpora/tas/fixtures/TAS-RSI-002.json"},{"adapter_bindings":{"binding":"tas.context-invocation.v0"},"expectation_profile_id":"tas.context-invocation.v0","fixture_id":"tas:TAS-RSI-004","fixture_source_id":"TAS-RSI-004","path":"corpora/tas/fixtures/TAS-RSI-004.json"},{"adapter_bindings":{"binding":"tas.context-invocation.v0"},"expectation_profile_id":"tas.context-invocation.v0","fixture_id":"tas:TAS-RSI-005","fixture_source_id":"TAS-RSI-005","path":"corpora/tas/fixtures/TAS-RSI-005.json"},{"adapter_bindings":{"binding":"tas.context-invocation.v0"},"expectation_profile_id":"tas.context-invocation.v0","fixture_id":"tas:TAS-RSI-006","fixture_source_id":"TAS-RSI-006","path":"corpora/tas/fixtures/TAS-RSI-006.json"}],"namespace":"tas","schema":"rsi-fixture-corpus.v0"}
