{"corpus_id":"capv-expiry-generation","fixture_directory":"corpora/capv/fixtures","fixtures":[{"adapter_bindings":{"binding":"capv.expiry-generation.v0"},"expectation_profile_id":"capv.expiry-generation.v0","fixture_id":"capv:CAPV-RSI-001","fixture_source_id":"CAPV-RSI-001","path":"corpora/capv/fixtures/CAPV-RSI-001.json"},{"adapter_bindings":{"binding":"capv.expiry-generation.v0"},"expectation_profile_id":"capv.expiry-generation.v0","fixture_id":"capv:CAPV-RSI-002","fixture_source_id":"CAPV-RSI-002","path":"corpora/capv/fixtures/CAPV-RSI-002.json"},{"adapter_bindings":{"binding":"capv.expiry-generation.v0"},"expectation_profile_id":"capv.expiry-generation.v0","fixture_id":"capv:CAPV-RSI-003","fixture_source_id":"CAPV-RSI-003","path":"corpora/capv/fixtures/CAPV-RSI-003.json"},{"adapter_bindings":{"binding":"capv.expiry-generation.v0"},"expectation_profile_id":"capv.expiry-generation.v0","fixture_id":"capv:CAPV-RSI-004","fixture_source_id":"CAPV-RSI-004","path":"corpora/capv/fixtures/CAPV-RSI-004.json"},{"adapter_bindings":{"binding":"capv.expiry-generation.v0"},"expectation_profile_id":"capv.expiry-generation.v0","fixture_id":"capv:CAPV-RSI-005","fixture_source_id":"CAPV-RSI-005","path":"corpora/capv/fixtures/CAPV-RSI-005.json"},{"adapter_bindings":{"binding":"capv.expiry-generation.v0"},"expectation_profile_id":"capv.expiry-generation.v0","fixture_id":"capv:CAPV-RSI-006","fixture_source_id":"CAPV-RSI-006","path":"corpora/capv/fixtures/CAPV-RSI-006.json"},{"adapter_bindings":{"binding":"capv.expiry-generation.v0"},"expectation_profile_id":"capv.expiry-generation.v0","fixture_id":"capv:CAPV-RSI-007","fixture_source_id":"CAPV-RSI-007","path":"corpora/capv/fixtures/CAPV-RSI-007.json"},{"adapter_bindings":{"binding":"capv.expiry-generation.v0"},"expectation_profile_id":"capv.expiry-generation.v0","fixture_id":"capv:CAPV-RSI-008","fixture_source_id":"CAPV-RSI-008","path":"corpora/capv/fixtures/CAPV-RSI-008.json"},{"adapter_bindings":{"binding":"capv.expiry-generation.v0"},"expectation_profile_id":"capv.expiry-generation.v0","fixture_id":"capv:CAPV-RSI-009","fixture_source_id":"CAPV-RSI-009","path":"corpora/capv/fixtures/CAPV-RSI-009.json"},{"adapter_bindings":{"binding":"capv.expiry-generation.v0"},"expectation_profile_id":"capv.expiry-generation.v0","fixture_id":"capv:CAPV-RSI-010","fixture_source_id":"CAPV-RSI-010","path":"corpora/capv/fixtures/CAPV-RSI-010.json"},{"adapter_bindings":{"binding":"capv.expiry-generation.v0"},"expectation_profile_id":"capv.expiry-generation.v0","fixture_id":"capv:CAPV-RSI-011","fixture_source_id":"CAPV-RSI-011","path":"corpora/capv/fixtures/CAPV-RSI-011.json"}],"namespace":"capv","schema":"rsi-fixture-corpus.v0"}
