{"corpus_id":"crystal-receipt","fixture_directory":"corpora/crystal-receipt/fixtures","fixtures":[{"adapter_bindings":{"snapshot":"crystal-receipt.v0"},"expectation_profile_id":"crystal-receipt.v0","fixture_id":"crystal-receipt:CR-RSI-001","fixture_source_id":"CR-RSI-001","path":"corpora/crystal-receipt/fixtures/CR-RSI-001.json"},{"adapter_bindings":{"snapshot":"crystal-receipt.v0"},"expectation_profile_id":"crystal-receipt.v0","fixture_id":"crystal-receipt:CR-RSI-002","fixture_source_id":"CR-RSI-002","path":"corpora/crystal-receipt/fixtures/CR-RSI-002.json"}],"namespace":"crystal-receipt","schema":"rsi-fixture-corpus.v0"}
